{
  "id": "hero.swinger",
  "displayName": "SWINGER (placeholder name)",
  "movement": {
    "runSpeed": 9,
    "groundAccel": 60,
    "airAccel": 20,
    "gravity": 28,
    "jumpSpeed": 10,
    "maxFallSpeed": 50,
    "coyoteTime": 0.1,
    "jumpBufferTime": 0.1,
    "halfWidth": 0.35,
    "height": 1.8
  },
  "energy": { "max": 100, "regenPerSecond": 14, "regenDelay": 0.6 },
  "health": {
    "shield": { "max": 40, "regenPerSecond": 12, "regenDelay": 3 },
    "core": { "max": 60, "regenPerSecond": 1, "regenDelay": 8 }
  },
  "respawnDelay": 3,
  "abilities": ["ability.swing", "ability.zip", "ability.strike"]
}
